,link,text,timestamp,title
15,https://news.cnyes.com/news/id/4264438,"['在美國聯準會 (Fed) 主席鮑爾表示未來決定貨幣政策將更有「耐心」後，市場解讀升息速度將減緩，激勵美股大漲，亞股今 (7) 日也全面反彈，其中，台股加權指數開高走高，強彈超過 2.2%，終場收在 9590.3 點，上漲 207 點，量能則縮至 918 億元，演出破底翻的反攻行情，法人指出，農曆年前紅包行情主要是由內資主導中小型股走勢，平常心看待指數位置。', '大型權值股今聯袂大反攻，大立光強彈逼近 7%，可成、台達電均漲逾半根停板，台塑四寶有 2-5% 不等的漲幅，統一、統一超漲逾 3%，永豐金、開發金、華碩均漲超過 3%，聯電、亞泥、彰銀、台新金、元大金、華南金、鴻海、國巨、台積電和群創均漲逾 2%。', '而光寶科、遠傳、中租、正新、友達、中壽、遠東新、台泥、中信金和寶成等均漲超過 1.5%。', '在大立光的帶動下，光學鏡頭廠同步受到拉抬，新鉅科漲停，玉晶光漲半根停板，先進光、今國光、聯一光漲 4% 之上，亞光和佳凌漲幅在 3% 上下。', '而 5G 概念持續發酵下，相關中小型概念股持續受到追埲，光環一度漲停，華星光、眾達 - KY 漲 4% 上下，聯鈞漲近 3%。', 'IC 基板族群也再度轉強，景碩大漲 7%，同欣電和南電漲 4% 上下。被動元件族群也見到逢低買盤進場，除了國巨漲 2.4%，華新科大漲半根停板，蜜望實和禾伸堂漲 2-3% 左右。', '法人指出，蘋果下修財測導致美股重挫，蘋概股近來壓力重重，但實際上從去年第 4 季 iPhone 銷售不如預期以來，台股相關供應鏈股價皆已事先反映，儘管目前為產業淡季，股價不易有強勢表現機會，但短線不至於見持續重挫的壓力。', '事實上，大盤技術面仍處弱勢，所幸中小型股相對強勢，可判斷市場信心仍維持正向，短線投資人若有意布局紅包行情，可聚焦強勢中小型股中採偏多操作。']",2019/01/07 14:39,台股盤後 破底翻反彈行情發威強彈逾200點收復9500點
16,https://news.cnyes.com/news/id/4269655,"['中華電信 (2412) 今(17)日表示，繼 2018 年底獲國際報告權威機構 OpenSignal 公布調查報告「4G 下載速度」及「整體下載速度」獲業界雙料冠軍，蟬聯第一。國際權威測速領導品牌 Ookla 旗下知名網站 Speedtestâ 於 16 日公布台灣行動網速最新調查結果，中華電信蟬聯 2018 年下半年「台灣行動網速第一名」大獎。依據 Speedtestâ 網站所公布，2018 年下半年台灣電信業者行動網路報告，是採集全台 74 萬台裝置、超過 696 萬次測量樣本，所分析出來的報告結果，其測試結果亦獲國內外媒體大量引用。分析報告顯示，中華電信行動平均下載速度遠超越同業達 26%-219%，而且速度得分較上半年成長 14%，下載速度更相較上半年成長 14% 達 53.89Mbps，成長幅度皆為業界之冠。而手遊族群最在意的「低延遲度」達 25ms，也為業界之冠。\n\n依據通傳會公布最新全台 4G 基地台數量，中華電信在 2018 年 12 月底達 14,599 台，為業界最多，且在全台各縣市佈建數量均為第一，相較同年 7 月底成長 12%。由於基地台數量持續大幅超越同業，4G 網路品質也大幅躍進。\n\n中華電信董事長鄭優表示，蟬聯 Speedtestâ、OpenSignal 下載網速冠軍的殊榮，是客戶對中華電信最大的肯定。中華電信行動通信分公司總經理陳明仕表示，2019 年，為更能提升尖峰時刻客戶下載速率，4G 將持續建設高頻段基地台 (1800MHz 及 2600MHz)，同時特別針對全台超過 500 處人潮密集區域，運用中華電信擁有全台 4G 最大頻寬資源，獨家提供高速基地台 6CC 技術，讓客戶對行動品質提升更有感。']",2019/01/17 14:11,中華電去年底4G基地台為業界最多蟬聯Speedtesta台灣行動網速冠軍
17,https://news.cnyes.com/news/id/4265804,"['根據路透社於 1 月 8 日報導指出，中國電信網路設備供應商華為與在伊朗和敘利亞經營的公司關係密切，這份未被曝光的文件內容，將為美國指控孟晚舟案提供新的線索。', '在去年 12 月 1 日時，華為首席財務官 (CFO) 孟晚舟因涉嫌欺詐在加拿大被捕。當時美國司法機構指控，孟晚舟違反制裁令透過一家香港公司與伊朗進行交易，而為了掩飾該行為又欺詐了幾家銀行。同時，華為不僅違反規定向伊朗販賣涉及美國的高科技產品，而且與敘利亞也有十分密切的貿易關係。', '因此司法機構調查重點在於華為疑似與兩家公司在中東地區的公司有關聯，其中一家公司位在德黑蘭營運的電信設備銷售商 (Skycom Tech)，另外一家則是其母公司，是在模里西斯註冊的控股公司 (Canicula Holdings)。', '孟晚舟則宣稱這兩家公司獨立於華為之外，然而調查卻認為這兩家公司實際是由華為掌控。而根據在伊朗和敘利亞發現的企業檔案，以及其他資料顯示，華為與這兩家公司的關係比之前為人所知的更緊密。', '其中，一位華為高階主管似乎被指派為 Skycom 的伊朗業務經理，並且至少有三位中國姓名的人士在華為與 Skycom 在伊朗開設的銀行帳戶有簽名權。\xa0', '而美國司法機構向加拿大法院提供的檔案內容也顯示，2007 年至 2013 年間 Skycom 的銀行帳戶簽署者是華為集團的工作人員。', '此外，一位中東律師表示，華為透過 Canicula 在敘利亞開展業務。而該律師正是華為在敘利亞一家公司的清算人。', '路透社報導顯示，近幾年華為在敘利亞的公司表面上已解散，但華為暗中仍一直在敘利亞透過不同公司繼續營運，這其中就包括 Canicula Holdings，該公司直到 2015 年仍在敘利亞設辦公室。', '路透社報導指出，華為之前表示其與 Skycom 之間是「一種正常的商業夥伴關係」，此說法恐怕因為最新的事證導致說服力減弱。新事證也可能不利於孟晚舟案後續的發展。']",2019/01/09 17:10,華為案再爆新證據孟晚舟雪上加霜
18,https://news.cnyes.com/news/id/4266862,['豪華遊艇製造商東哥遊艇 (8478) 受惠新產品及澳洲新據點在下半年初見成效，及第四季進入旺季銷售強勁，全新設計的 90 呎遊艇已於 2018 年第四季正式開始銷售，市場反應熱烈，12 月營收 10 億元，年增 82%，也推波全年營收 39.6 億元，年成長 9.2%，創下歷史新高。東哥 2019 年預計將再推出兩款新船型，並持續布局歐洲、澳洲等新市場，開拓成長動能。東哥自有品牌「Ocean Alexander（OA）」為美國豪華遊艇的第一品牌，OA 系列豪華遊艇中，新船型 90 呎遊艇已於 2018 年底的美國羅德岱堡遊艇展正式亮相，參觀船主絡繹不絕，詢問度熱烈，預期將成為主力船款之一。\n\n年底為遊艇交船旺季，東哥去年因大型遊艇交船時程落在第四季，單季營收創下歷史新高 21.5 億元，帶動全年營收再度改寫歷史紀錄。為平衡淡旺季營收，著力於強化產品組合，拓展小尺寸遊艇代理業務以及強化維修服務，去年代理及維修業務營收均呈倍數成長。\n\n展望 2019 年，東哥將持續積極投入新產品開發、加速推出週期，今年上下半年各有一款新船型問市，以多元的產品線滿足客戶的不同需求；此外，將持續開拓歐洲、澳洲新市場、及推展代理與維修等各項服務業務，2019 整年營運展望審慎正向。'],2019/01/11 14:23,年底交船旺東哥遊艇去年營收創新高今年展望審慎正向
19,https://news.cnyes.com/news/id/4273423,"['遊戲大廠智冠 (5478-TW) 旗下遊戲研發商中華網龍 (3083-TW) 今 (24) 日宣布，旗下自製經典端遊轉手遊《吞食天地 M》，正式授權東南亞營運商 ASIASOFT，該公司曾代理魔獸世界、星際爭霸 2、楓之谷等多款知名遊戲，雙方共同合作進軍東南亞，可望再為《吞食天地 M》當地表現挹注強勁動能。', '網龍去年 9 月新推出的經典端遊轉手遊《吞食天地 M》，為以三國 Q 版人氣線上遊戲《吞食天地 Online》完整復刻打造，帶動網龍去年營收較 2017 年大增逾 6 成，達到 6 億元，並使網龍去年第 3 季成功單季轉盈。', '法人指出，網龍去年上半年的 1982 萬元虧損額，可望靠 9 月單月獲利來彌補，而 10 月的獲利表現，也有機會與 7、8 月虧損額相抵銷，前 10 月已成功損平，去年全年可望順利轉盈，獲利表現端看 11、12 月的遊戲貢獻。', '而網龍今日也宣布，《吞食天地 M》進軍海外的營運商已敲定，將由東南亞知名遊戲營運商 ASIASOFT 負責，該公司總部位於泰國曼谷，曾代理過魔獸世界、星際爭霸 2、楓之谷、熱血江湖、武林群俠傳、天子傳奇、仙境傳說 2(RO 2)、LUNA、全民足球、反恐行動、RF Online、Phantasy Star Online 2 等多款遊戲，營運版圖及經驗多元豐富。']",2019/01/24 20:39,網龍旗下熱門手遊《吞食天地M》 授權營運商ASIASOFT進軍東南亞
20,https://news.cnyes.com/news/id/4276594,"['美中新一輪談判進展至第二天也是最後一天的談判，美國總統川普 (Donald Trump) 週四 (31 日) 推文表示對美中達成全面貿易協議保持樂觀，但他警示，任何沒有向美國農、工、製造業等全面開放中國市場的安排，都是不可接受的。', '距離美中 90 天休戰截止日，還剩一個月的時間，這次是自川普於 12 月 1 日與中國國家主席習近平會面以來最高層級的會談，會後川普將與中國代表團團長、國務院副總理劉鶴會面。', '雖然本輪談判不太可能達成突破性的最終協議，但川普政府表示已在「智慧財產權實踐」、「中國市場開放」、「中國強制性技術轉讓」和「購買更多美國商品等北京先前的承諾」取得進展，會後將對此發表總結聲明。', '川普在推文表示：「美中會談進展順利，雙方都帶著良好的誠意與意願。」還提到：「直到我與我的朋友習近平主席會面，討論一些長期存在並對更艱難的問題達成一致，美中才會達成最終協議。」', '川普表示：「中國代表和我正在努力達成一項完整的協議，不留下任何懸而未決的問題。」', '川普期待：「中國不僅要向金融服務開放市場，而且向我們的製造業、農民以及其他美國企業開放市場，沒有這些的協議將是不可接受的！」', '白宮消息人士表示：「迄今為止，白宮關注的是實質內容，而不是下一步。」', '川普在週四 (31 日) 記者會中提到：「要麼達成一項非常重大的美中貿易協議，要麼就推遲。」但目前尚未不清楚其意為何？', '針對是否會推遲 3 月 1 日截止的休戰最後期限時，川普回應：「我不知道。」', '川普亦提到：「中國希望達成協議，以避免增加關稅。如果可以，如果可以的話，我願意接納他們 (意見)。如果我們能達成協議，我願意遷就中國。」', '據外媒報導，中方談判代表提議川普和習近平下月在中國海南省舉行會面，兩名白宮官員表示，在目前的會談中，中方並未邀請川普與習近平會面，但如果在川劉會晤中，中方提出邀約，他們不會感到意外。', '美中雙方正為在 90 天休戰前達成永久性協議進行努力，為解決雙方的貿易分歧，川普威脅說，如果不能達成協議，3 月 2 日將對價值 2000 億美元的中國商品的關稅從 10% 提高到 25%，並對其他剩餘中國進口商品課徵新的關稅。']",2019/02/01 04:02,對談判抱持樂觀川普：如果能達成協議我願意遷就中國
21,https://news.cnyes.com/news/id/4271850,"['投資人對美股的情緒似乎已走出去年 12 月拋售時的恐慌，不過摩根士丹利首席美國股票策略師 Michael Wilson 仍然警告，標普 500 指數今年還將測試 12 月的低點，投資人應該趕緊賣出股票。', 'Wilson 表示，經過 1931 年以來最糟糕的 12 月之後，美股有望出現亮麗的 1 月成績，MSCI 世界指數今年以來已上漲 4.5%，各國股市都欣欣向榮，但事情卻可能好景不長。', 'Wilson 指出，市場在過去 6 個月所擔心的事情仍在形成，甚至可能更糟。經濟增長正在急遽減速，企業獲利下降幅度也是 2015-16 年以來最快。以首週所公布金融業為主的財報來，EPS 成長僅約 0.75%，是 2016 年以來最低。', 'Wilson 表示，通常在股市大跌後，投資人在壞消息時還積極買進，是強烈的買進信號，說明利空已經被股市先定價。然而，Wilson 提出 3 點，投資人可能樂觀過頭。', '首先，金融股雖然現階段表現相對強勁，但他們是去年表現最差的股票之一，原因是環境嚴竣，尚不知那些公司能否存活下來。簡而言之，即使經過大跌，金融股的估價可能還相對其他行業過高。', '其次，預期中的獲利修正尚未出現，很多比定價糟的公司還沒公布財報。最後，一堆利空仍等在後頭，包括美國政府關閉、貿易不確定性持續、英國脫歐談判失敗，以及聯準會仍在縮減資產負債表、經濟數據的惡化正在加速，種種因素都還會衝擊股市。', 'Wilson 指出，無論好消息或壞消息，如果市場過於一致認可，那麼投資人在那個時間點，可能要考慮往另一個方向，例如去年對減稅的興奮。今年 1 月市場的一致看漲，可能就是個錯誤。', 'Wilson 認為，現階段應先隨著市場反彈減碼，他相信，伴隨著可能來臨的基本面壞消息，加上政治上戲劇性動盪，市場將重新測試去年 12 月的低點。']",2019/01/22 16:10,美股反彈是利空出盡？大摩：還會再跌把握反彈宜賣出持股
22,https://news.cnyes.com/news/id/4273641,"['鉅亨網長期關注智能投資議題，自今年舉辦「金融台灣 科技未來：機器人理財論壇」以來，許多投資人都紛紛來信詢問，什麼類型的人適合智能投資? 該如何運用智能投資平台穩定勝率? 目前有那些平台可以選擇? 智能投資如何解決投資難題? 什麼是再平衡機制? 如何挑選智能投資服務？等等與智能投資相關的問題。為了更深入回答投資人的疑問，特別整理以下使用智能投資建議與方法，來因應明年 2019 詭譎多變的投資市場。', '最近根據國外研究報告指出，2017 年智能投資顧問平台的資產管理規模已超越 2000 億美元，且 2018 年至 2022 年將以每年 37.5% 速度成長，到 2022 年資產規模可達 1.44 兆美元。甚至將取代部分傳統財富管理業務，顯示智能投資風潮已經不容忽視。', '(點擊開箱影片 可了解更多)', '今年全球受到美國持續升息、美中貿易戰及國際情勢緊張等諸多因素影響，全球金融市場震盪劇烈。許多新手投資人會較難以駕馭突發事件，機動性地調整資產組合配置，也因此為了解決投資人的理財盲點及痛點，智能投資服務目前正如旋風般席捲全球。智能投資講求大數據預測模型、智能演算及投資組合再平衡，目前在台灣，檯面上已超過 9 間金融機構推出智能理財服務，包含：國泰世華、王道銀行、台新銀行、瑞士銀行，除此之外，還有第三方機構及投信投顧推出相關服務，搶攻智能投資商機。', '面對市場震盪局勢，想要降低市場波動影響，我會建議投資人採取穩健型多元資產配置，採長期投資、善用分批加碼佈局一些防禦性的標的，股市方面如電信、醫療、能源與公共事業等產業，此類型股票較不受市場環境影響，漲跌較平穩，債市方面則可考慮具防禦性質的投資等級債或美國公債。由於全球主要股市和債市已經來到歷史相對高檔，預計要有高報酬表現並不容易，風險也會越來越高，所以宜採取長期投資策略，從震盪的市場中，伺機找到投資機會，同時搭配定期定額的方式，以分散進場時間，若遇到市場大修正，可以單筆進場，分批逢低加碼，但長期下來這樣的策略其實費時又費力。', '平常我公務繁忙，最近為了縮減平日整盤的時間，在國泰智能投資平台今年十月上線之後，就立即到平台做完投資習慣及風險調查，確認與自己平時投資習慣相符合後。用國泰智能投資平台試算推薦給我一個全球股市比重 3.5 成、債市比重 6.5 成的投資組合配置。', '雖與過去直接投資基金有些差異，但從線上交易、提供資訊、投資標的選擇、投資費用上的計算到投資紀律的實踐都與以往相較簡單省時且門檻低。登入國泰智能投資，就可隨時隨地掌握自己投組的投資表現，輔以理性分析，大幅降低因心理因素造成的錯誤判斷，以增加目標達成機會。', '以國泰智能投資平台來說，有個好處是 24 小時全年無休監控投資組合，持續依據市場情況、產品標的表現程度等，隨時監控該投資組合的動態，並不斷優化背後演算法，以便合理控制風險。', '啟動再平衡機制的時機點，包括市場波動造成投資組合比例失衡、投資人的風險屬性改變、經過專業團隊評估提出有必要調整，以及當投資標的表現落後或遇到基金狀態改變 (如額控、下架、清算等)，遇到這些情況，投資人往往無法判斷甚麼時候該買甚麼時候該賣，國泰智能投資會主動發送調整通知，提供投資組合調整方向給投資人，當市場有變動時，讓我瞭解目前投資的狀況，過程十分便捷、快速，使我較不會受到市場波動及不理性的投資判斷，而干擾了既有的投資目標，就算是沒有投資經驗的小白，相信也能簡單上手，並長期維持投資應有的紀律。此外，再平衡還有另一個好處，就是賣出已賺取超額報酬的標的少部分單位數，並將獲得的資金再買入表現相對落後的標的，這樣就能實現賣高買低的投資法則。', '智能投資結合投資組合理論、大數據，讓投資人多了一種選擇，可以避免 “追高殺低” 的情緒。且相較於傳統投資顧問，智能投資最大的特點就是低門檻、低費用、高效率，對於一般受薪小資族具有吸引力。以往想要享受 VIP 級的財富管理服務，由專人打造專屬的投資組合，資金門檻動輒數百萬元，智能投資的出現，讓中產階級，也能夠享有專家級的資產配置服務。以國泰世華智能投資為例，民眾可選擇以新臺幣或美元來投資，定期定額每月最低金額為 5,000 新台幣或 200 美元。門檻都不算高。目前國泰智能投資平台僅收年費率 0.88% 的信託管理費，客戶調整投資組合也不會另外再收取其他費用。即日起到 2019 年 06 月 30 日前，還享有免信託管理費優惠。', '整體來說，這麼多金融業者都推出智能理財服務，那麼投資人該如何選擇？回歸到投資目的，要看 KYC 問卷填完後，建議出來的投資組合，風險與報酬比例，是否符合自己的個性與需要。', '選擇智能投資，主要仍是在於其低門檻與操作簡易便利性。透過演算法來方便管理自己的投資組合，在可承受的風險範圍內尋求合理的投資報酬，才是這項智能投資服務的真意。而國泰智能投資可協助客戶在透明的量化模型下，建立客製化投組，透過上述的理論與模型，最終將依據你提供演算的參數 (預計投資時間、目標達成金額、每月可投資金額)，計算出最適合的投資組合波動度，並找出效率前緣上的資產配置組合，並由你依據自身喜好選擇資產類別下的投資標的，只要簡單四步驟即打造客製化的投資組合計畫。', '且後續在 24 小時監控市場與資產配置保護傘下，定期獲得投資相關資訊與不定時的再平衡調整通知，提醒投資人調整投組配置，幫忙通知賣買的最佳時機點，投資人可隨時保持最佳的投資組合與理財紀律，使投資風險有效再降低。', '<國泰智能投資 一杯咖啡 開始科學理財>', '(點擊圖片即可參加活動)', '國泰智能投資 <小檔案>- 點擊了解更多', '特色一、Fintech 創新技術成就多樣性個人專屬投資組合', '特色二、24 小時監控投資組合再平衡 維持投資紀律', '特色三、收費方式是管理費而不是買進賣出的手續費', '特色四、2019 年 6 月 30 日前享免信託管理費優', '本資料僅供參考，鉅亨網已盡力就可靠之資料來源提供正確之意見與消息，但無法保證該等資料之完整性。投資人應依其本身之判斷投資，若有損益或因使用本資料所生之直接或間接損失，應由投資人自行負責，本公司無須負擔任何責任。', '※本文係由國泰世華銀行邀稿\n※優惠期間至 2019 年 6 月 30 日止，詳細專案說明以國泰世華網站公告為準。\n【投資警語】本專案之基金經金管會核准或同意生效，惟不表示絕無風險。基金經理公司以往之經理績效不保證基金之最低投資收益；基金經理公司除盡善良管理人注意義務外，不負責基金之盈虧，亦不保證最低之收益，投資人申購前應詳閱基金公開說明書。國泰世華保留隨時變更與停止本活動之權利，詳細內容請見網站公告。總行地址：台北市松仁路 7 號。聯絡電話： 02-2383-0289 。cathayrobo.com']",2019/01/25 10:22,〈2019投研觀點〉鉅亨網總經理：智能投資旋風正席捲全球！
