,link,text,timestamp,title
37,https://news.cnyes.com/news/id/4264947,"['根據昨日中國國家外匯管理局公布的資料顯示，截至 2018 年 12 月底，中國外匯存底規模為 3.07 兆美元，比 11 月份上升 110 億美元，漲幅為 0.4%。這是中國外匯存底在 7 月份連續 3 個月下滑後，自 11 月開始連續第二個月回升。', '而中國外匯存底的兩個月走揚，或許暗示著中國人行基本上沒有透過外匯存底干預匯率。所以本質來說，市場認同短線上人民幣貶值壓力已有所減輕。', '而人民幣成功守住「7」的關卡，有效提振投資人對人民幣的信心。相對其他新興市場國際貨幣，人民幣匯率的底線十分堅固，已經帶給市場牢不可破的想法。', '不過從金融市場歷史來看，事事無絕對，如果市場真的都認同「7」這個關卡不會貶破，一旦出現意外的黑天鵝 (如中美貿易談判有出乎預期重大利空) 後，隨之而來的失望氣氛將可能會讓人民幣出現大幅度的動盪。\n\u2002\u2002\u2002\u2002\n從 2018 年全年來看，整體中國外匯存底是下滑，這反映去年人民幣在下半年出現較重的貶值壓力。而近兩個月外匯存底小幅回溫的主要原因，首先是美元近期相對走弱，因美國經濟數據開始有轉弱的跡象，加上市場猜測今年 FED 升息步伐放緩的可能性增加。\xa0', '其次是全球債券特別是美債殖利率下滑，意味美債價格上漲，對外匯存底資產價值產生正面的推升作用。', '而中國外匯存底連續兩個月回升，為未來中國人行寬鬆的貨幣政策創造出操作空間。短期內中國外匯存底回穩會抵消一部份中國人行降準將導致人民幣貶值的負面因素，但以目前局勢來看，中長期人民幣匯率仍有很大的機率維持穩定。', '總體來看，美元走勢對於中國人行是否干預匯市仍然非常重要。上周全球股、債、匯各個市場都出現較大的波動，但是美元指數仍然保持在 96-97 的震盪區間，預計短期美元仍繼續呈現震盪格局。不過，美元指數在去年 12 月份的略微走貶對於人民幣的壓力相對減輕，這也將使中國貨幣政策有更強的獨立性。']",2019/01/08 10:56,中國外匯存底持續回溫人民幣短期止貶回穩
38,https://news.cnyes.com/news/id/4275448,"['美國財政部長梅努欽 (Steven Mnuchin) 接受外媒採訪時提到，若中國能提供足夠的貿易優惠，美國政府有可能取消所有關稅。', '美中新一輪談判即將展開，中國國務院副總理劉鶴將於週三 (30 日) 開始率團赴華府磋商，為期 2 天。除了美國對中國經濟結構性改革的要求外，本輪談判將涵蓋北京承諾購買更多美國商品的細節。', '美國財政部長梅努欽 (Steven Mnuchin) 接受外媒採訪時表示，若中國能提供足夠的貿易優惠，美國政府有可能取消所有關稅，談判桌上一切皆可能。', '由於時機敏感，美國司法部正以詐欺與竊取商業機密等 23 項罪名起訴中國科技巨頭華為與其財務長孟晚舟。對此，梅努欽堅稱此案與貿易談判無關，並稱此前他並不知情這項案件。', '梅努欽表示：「所以那些 (華為案) 不是貿易討論的一部分。這些是不同的問題，不應混淆。強迫技術問題是貿易討論的一部分，但任何與違反美國法律或美國製裁有關的問題都要經過一個單獨管道處理。」', '屆時對華鴿派梅努欽、反中鷹派美國貿易代表萊特希澤 (Robert Lighthizer)、白宮貿易政策顧問納瓦羅 (Peter Navarro) \xa0將一同接見中國代表團。為了表明白宮看重此談判的重要性，川普有望於週四 (31 日) 與劉鶴會面。', '川普的貿易團隊內部仍存在分歧，包括白宮鷹派人士尋求對中國更嚴厲的條款，而梅努欽與和白宮經濟顧問庫德洛 (Larry Kudlow) 則優先考慮保護美國經濟增長。']",2019/01/30 01:19,有望解除關稅？美財政部長：談判桌上一切皆可能
39,https://news.cnyes.com/news/id/4271471,"['喧騰一時的浩鼎案 (4174-TW)，去年底經法院判決，前中研院院長翁啟惠與浩鼎生技董事長張念慈皆獲「無罪」宣判，今 (21) 日士林地檢署檢視全案後，檢方決定放棄上訴，翁啟惠與張念慈確定無罪。', '浩鼎也在第一時間發出聲明表示，浩鼎貪污行賄案今天終告落幕，感謝一路相伴的投資人和各界朋友的支持，浩鼎指出，未來將以多元化癌症新藥公司為目標，希望早日得到具體的成果，答謝各界的關心，浩鼎說明，浩鼎案歷時約 3 年，也讓浩鼎和社會共同經歷的寶貴一課。', '士林地檢署今日下午發布新聞稿表示，檢察總長江惠民在召開兩次會議後，決議以現有證據難改判有罪，因此決定放棄上訴，江惠民也直言，檢方應勇於承擔冤錯案，「不要為了上訴而上訴」。']",2019/01/21 18:09,浩鼎案最新進展檢方放棄上訴翁啟惠張念慈確定無罪
40,https://news.cnyes.com/news/id/4268079,"['考量今 (2019) 年春節假期休市 (1 月 31 日至 2 月 10 日) 長達 11 日，為因應國際金融市場於國內期貨休市期間可能發生的價格波動，期交所今 (14) 日宣布，將於春節假期期間，調高股價指數類契約、商品類契約及匯率類契約保證金，預計以 1 月 29 日的結算保證金為基礎調高約 10%。', '期交所表示，鑒於以往春節假期採行調高保證金作法，有助於市場運作安全的確保，將於今年春節假期，調高股價指數類契約、商品類契約及匯率類契約保證金，預計以 1 月 29 日的結算保證金為基礎調高約 10%，例如，臺股期貨現行原始保證金 96,000 元將調高至 107,000 元，調幅約 11.5%，屆時期交所將另行公告調整金額，以強化期貨市場的風險承受度，維護市場安全。', '期交所強調，預計於今年 1 月 29 日 (調整生效日前一日) 公告股價指數類契約、商品類契約及匯率類契約保證金調整後金額，實施期間為 1 月 30 日 (春節前最後交易日) 一般交易時段收盤後生效，預計至 2 月 12 日一般交易時段結束後恢復為調整前 1 月 29 日的保證金，例如，臺股期貨原始保證金將自調高後 107,000 元調回調整前 96,000 元。', '另外，期交所提醒交易人注意，1 月 30 日為期貨集中交易市場農曆春節前的最後交易日，當日下午 3 時開始的盤後交易時段，仍將交易至次日上午 5 時。交易人於 1 月 30 日一般交易時段收盤後的未沖銷部位，及當日盤後交易時段的新增部位，應以調高後的原始保證金數額計收。交易人應注意盤後交易時段及長假期間未沖銷部位的風險及帳戶權益數變化；期貨商對期貨交易人亦應加強注意並落實風險控管。', '期交所表示，因應 1 月 31 日至 2 月 10 日無交易，依各商品交易規則，2 月第 1 週到期的小型臺指期貨及臺指選擇權一週到期契約，最後交易暨結算日順延至 2 月 11 日；1 月到期的印度 50 期貨契約最後交易日為 1 月 30 日，最後結算日為 1 月 31 日；2 月到期的東證期貨契約最後交易日為 1 月 30 日，最後結算日為 1 月 31 日；3 月到期交割的布蘭特原油期貨契約，到期最後交易截止時間不調整，可交易至 1 月 31 日上午 5 時並以 2 月 11 日為最後結算日。', '另外，1 月 31 日及 2 月 1 日不開市，僅辦理結算交割事宜。\n\xa0']",2019/01/14 20:40,春節假期長達11日期交所憂國際市場震盪擬調高保證金約10%
41,https://news.cnyes.com/news/id/4266270,"['為響應政府離岸風電計畫，台船 (2208-TW) 集結國內海運和造船公股企業今 (10) 日舉行「四方合作意向書簽署儀式」，與陽明 (2609-TW)、台航 (2617-TW) 和台灣港務港勤公司簽訂合作意向書，台船董事長鄭文隆更透露，明年離岸風電將相當普遍，未來四家業者會評估是否需要投資，不排除成立合資公司。', '台船說明，四家業者業務合作初期先以風電零組件拖 (駁) 船運輸業務和船舶運維保養為主，中後期再發展相關維修、救援和人員專業訓練等，藉此合作專案，將可帶動國內海事工程產業參與離岸風電建設，達成技術生根、產業升級。', '鄭文隆進一步指出，簽訂合作意向書後，先成立工作小組，一方面尋求國外廠商協助，一方面以母雞帶小雞的方式將國內中小廠商整合，未來「邊走邊看，如果走得很順，四家業者不排除成立合資公司」，目前已與幾乎所有的開發商接洽中。', '鄭文隆說，台灣港灣工程施工已發展逾 40 年，於 2015 年運用國際先進工法與施工船機，完成台灣首座「離岸海氣象觀測塔」海上運輸和安裝工程，2016 年國內海工團隊也協助上緯順利完成「海洋離岸一期示範風場」，此兩座離岸風機安裝工程可視為台灣離岸風電開發主要的里程碑，未來，台灣本土海事工程施工船隊將進入實質推進階段。', '台灣港務港勤公司董事長張國明表示，除擁有拖船和眾多專業船員外，在全台各大商港另有各式船舶資源如拖船、測量船、起重船以及修船設施設備等優勢，並於今年起將 2 艘專業風電運維船和 2 艘 6400 馬力拖船投入市場營運。', '陽明董事長謝志堅表示，陽明具有船舶維運、船員管理等為基礎，希望為國內離岸風電產業盡一份心力。', '台航董事長劉文慶也指出，具有沿海港口拖駁船豐富操作經驗，有助於爭取風電業務初期所需的零組件和作業人員運輸作業。']",2019/01/10 11:43,三大上市航運業者攜手搶離岸風電市場不排除成立合資公司
42,https://news.cnyes.com/news/id/4264597,"['金屬機殼廠可成 (2474-TW) 今 (7) 日公布去年 12 月合併營收 66.98 億元，月減 30.4%，年減 28%，單月營收規模縮減至淡季水準，為近 8 個月低點；第 4 季合併營收 291.65 億元，季增 16.2%，由於營運旺季不旺，使單季營收年減 11.1%。可成指出，今年營運將更具挑戰，更保守看待今年景氣，認為今年可能延續去年第 4 季市況，獲利能力將低於過去幾年的平均數。', '可成去年全年合併營收 954.16 億元，年增 2.3%，創新高。不過，可成指出，去年第 4 季市場需求疲軟，導致營運出現旺季不旺的情況，預期此市況將延續至今年第 1 季，營運表現恐將較去年第 4 季更淡。', '展望今年，可成表示，今年可能也將延續去年第 4 季的市況，整體營運將更具挑戰，實際需求能見度充滿高度不確定性與波動性，將更保守看待今年景氣。且由於需求不確定性高，預期今年價格波動也將提高，在產品價格有壓的情況下，獲利能力預期將低於過去幾年的平均數。', '面對大環境的不確定性，可成強調，將持續導入新客戶、新產品，並加深自動化能力，應用智慧製造與提高營運效率，及加強成本費用管控，目標為取得優於產業的營運水準。']",2019/01/07 17:40,可成示警：今年營運更具挑戰營運恐延續去年Q4市況
43,https://news.cnyes.com/news/id/4272457,"['由於華為等中國科技大廠遭指控有嚴重資安漏洞，恐藉此竊取商業機密，行政院表示，正在編制一份詳細的中國科技公司黑名單，最快在今年 3 月底前完成。', '據日經報導，台灣行政院資通安全處處長簡宏偉指出：「我們可能會在 3 月底前完成並公佈一份可能構成安全威脅的中國科技公司名單，並不時更新名單，讓所有政府部門、組織和政府控制的企業在購買新設備時都能更加明確。」', '除了華為，中國電信設備製造商中興通訊和監控攝像機製造商杭州海康威視數位技術等皆可能入榜。政府機構和國有控股公司將被禁止使用名單中科技公司的設備。', '隨著美國、澳洲、紐西蘭、日本、英國和法國等國家都明確表態將抵制或禁止使用華為等廠商的產品，台灣也將擴大對中國企業的打擊力度。由於中國武力統一台灣的立場不變，台灣面臨的風險可能更大。', '簡宏偉表示，中國科技公司黑名單也將提供給民營公司，以供採購參考。 他也表示，資安處正在努力在於下週發布關於在政府機構使用電子設備的明確指導方針。此外，政府不會提供中國智慧手機給公務員，也會禁止公務員使用微信等通訊應用程式。', '該規定也適用於台灣自來水公司、台灣電力公司等國有企業，以及國家醫療中心和研究機構。內閣將要求監管部門審查中華電信，華航和兆豐金控等國有控股企業的電子設備使用情況。', '台灣自 2013 年以來便開始阻止無線通訊運營商和政府部門使用華為或中興通訊的設備，但這是首次提出一份清單，明確列出可能帶來安全風險的中國企業。', '總統蔡英文在新年致辭中表示，政府將針對中國電子設備供應商的安全問題進行研討。她表示:「我們不能在通訊安全方面留下任何漏洞。為了解決引起國際關注的中國公司通訊安全爭議，我要求我們的國家監管機構優先考慮並澄清所有相關問題，以確保所有關鍵基礎設施的資訊和通訊安全。」']",2019/01/23 12:54,日經：中國資安問題行政院將明列「陸企黑名單」
44,https://news.cnyes.com/news/id/4271641,"['由於中國經濟數據疲弱影響，引發全球經濟放緩隱憂，週一 (21 日) 美國指數期貨多走跌，美國股市和債市因紀念馬丁路德 · 金恩 (Martin Luther King, Jr.) 而休市。', '台北時間週一晚間 11 點 00 分左右，美股三大期貨指數暫報：', '經濟數據方面，中國國家統計局週一 (21 日) 公布，中國 2018 年國內生產總值 (GDP) 成長年增達 6.6%，自 1990 年以來最低。去年第四季中國經濟下滑加劇，年增率達 6.4%。美國與中國的貿易衝突讓中國「紙老虎」經濟現形，許多出口商被迫裁員因應。', '國際貨幣基金組織 (IMF) 週一宣布，由於全球貿易緊張局勢，預計今 (2019) 年全球經濟成長率為 3.5%，遜於去年 10 月預測的 3.7%，也低於 2018 年的 3.7%。', 'CMC Markets UK 首席市場策略師 Michael Hewson 在給客戶的一份報告中表示，無論以任何標準，中國在第四季經濟增長 6.4% 仍是體面的擴張，但已加深投資者對全球經濟放緩的隱憂，中國當局將繼續實施積極的財政政策，以因應最壞的影響。', '政經消息方面，美國和中國在許多貿易關鍵問題上仍存在爭議，美國除了指控中國政府 / 企業多年竊取美企的商業機密與智慧財產權外，爭執不下的關稅問題也進展甚微。', '新一輪美中談判在 1 月底展開，美國總統川普上週六 (19 日) 澄清外媒報導「美對中有望解除關稅」純屬造假，儘管他樂觀表示雙方磋商會進展順利。', '部分政府關門延長到第 30 天，民主黨拒絕川普上週末最新提議，即提出擴大對年輕非法移民「追夢者」的限時法律保護和其他讓步，以換取 57 億美元的美墨邊境牆經費。', '企業消息方面，本週 IBM、AMD 與 Ford 將陸續公布最新財報。']",2019/01/22 00:07,中國經濟數據拖累指數期貨走低美股今休市
45,https://news.cnyes.com/news/id/4263514,"['受到蘋果財測利空空襲，美股慘跌，台股無意外地也開低走低，以下跌 65.18 點、9427.24 點開出，不到一分鐘就跌破 9400 點，早盤最低跌逾 150 點，摜壓到 9338.24 點，創一年以來新低，蘋概股全倒，資金續進生技、5G、豬瘟概念股逆勢突圍。', '台北股市今天開盤跌 65.18 點，加權股價指數為 9427.24 點，成交金額新台幣 18.51 億元。', '大盤權值股部分，台積電跌近 3%，跌破 210 元，最低打到 209.5 元再破底；大立光跌超過 2%，最低跌到 2940 點；鴻海則跌近 2%，最低跌到 67.7 元續破底；其餘台塑化跌 0.9%，國泰金、富邦金都跌超過 1%。', '不只蘋概三王大跌，蘋概股持續全倒，包括：可成、強茂、玉晶光、國巨、鴻準、正崴等都表現疲弱。', '多頭資金持續湧進生技、5G、豬瘟概念股，生技股部分，瑞基亮燈漲停，毛寶也大漲 7%，科妍、佐登 - KY、浩鼎、寶齡富錦、邦特、大江等都逆紅。5G 的波若威、友訊、先豐、高技、上詮也是撐盤要角。而金門傳出非洲豬瘟疫情，也讓豬瘟概念股的大成、卜蜂分別逆勢走揚 3%、4%。']",2019/01/04 09:30,台股挫逾150點失9400點生技、5G、豬瘟概念股逆勢突圍
46,https://news.cnyes.com/news/id/4266913,['筆電大廠 12 月業績全數出爐，龍頭廣達 (2382) 最為突出，第四季單月業績首度均逾千億元大關，單季營收一舉突破 3 千億元，達 3166.85 億元，季增 12.24%，年增 12.4%，再創歷史新高，推升全年營收達 10.3 兆元，年增率翻正達 0.65%。據了解，廣達上季業績突出，主要是因為替蘋果 (Apple) 出貨 Apple Watch 與 Macbook 筆電新機種效應，儘管蘋果近期下修財測，但廣達沒有 iPhone，使得業績表現相對穩健。\n\n此外，英業達 (2356)12 月營收來到 470.22 億元，月增 15%，年增 5.8%，表現穩健，上季營收為 1340.9 億元，季減 4.95%，年增 1%，累計全年營收為 5068.73 億元，年增率為 8.4%。\n\n緯創 (3231)12 月營收優於預期，為 864.34 億元，月增 12.23%，年增 4.78%，第四季營收為 2550.8 億元，季增率為 12%，年減 2.5%，累計全年營收為 8892.62 億元，較前一年成長 6.4%。\n\n和碩 (4938)12 月營收 1057.5 億元，月減 39%，年增 18.6%，上季營收達 4660 億元，季增率逾 44%，年增率逾 23%，創下歷史新高；累計全年營收為 1.34 兆元，較前一年成長 12.3%。\n\n仁寶 (2324) 上月營收為 857 億元，月減 10.2%，年增 14.6%，表現平穩。第四季營收為 2803 億元，季增 10.6%，年增 10%，創下歷史新高紀錄，全年營收 9676.8 億元，年增 9%。'],2019/01/11 15:30,筆電大廠上季業績出爐廣達、和碩、仁寶寫下新高
47,https://news.cnyes.com/news/id/4271192,['麗正 (2302) 過去 20 年來低調轉型，這幾年積極切入智慧型手機、車用電子等領域轉型有成，到去年第三季單季毛利率已拉高到 38.03%，負債比率更降至 18.22%，財務結構好轉且已具備配息能力。展望今年，受惠跨足到 5G、車電、雲端、AI 等領域，並打入國際大廠如 Apple、LG、Panasonic、Tesla、Toyota 供應鏈，去年底罕見舉辦法說，透漏未來聚焦包括人工智能 / 機器人 / 智能家居，區塊鏈 / 挖礦機，雲計算 / 5G 基地站，大數據，以及電動車 / BMS/ECU/BMU / 充電樁等 5 大領域，法人估在高毛利新產品出貨挹注下，麗正今年營運在去年轉盈後可望大幅成長，同時今年第二季可望恢復信用交易。\n\n除了基本面明顯好轉、財務結構大幅改善外，麗正更是具有閒置中的龐大土地資產，除了土城廠生產基地 1402 坪，市值近 10 億元之外，公司資產負債表中尚有一筆不動產列於『投資性不動產』會計科目之下，經查證該筆不動產為公司 25 年前在台中取得約 1.7 萬坪土地，原本當初規劃作為焚化爐之外，因為政策改變而作罷，目前閒置中，由於該地段緊鄰中科，從去年第三季財報揭露公允市價高達 18 億元來看，以麗正目前股本 16.63 億元計算，每股價值已超過一個股本。\n\n麗正目前股票總市值約 16～17 億元，若被同業或大戶相中，只要花 16 億元就能買下麗正所有股權，屆時再賣掉台中土地，不但可以馬上收回成本 16 億元，還淨賺近 2 億元現金收入。不僅如此，更免費奉送麗正目前土城工廠土地、建物以及包括土城，上海，浙江等生產線，以及這幾年來打拼累積爭取來包括 Apple、Tesla、Toyota 等國際大廠對於生產線及產品的認證，甚至直接切入國際大廠供應鏈，是相當划得來的一筆交易。\n\n近期光寶科 (2301) 股價奮發向上，旗下子公司敦南 (5305) 也是整流二級體廠商，敦南轉投資一籮筐，光寶科總市值 1000 億元，敦南總市值也高達 100 億元，就規模來看，麗正股價 10 元的總市值微不足道，若未來麗正的真正價值能被彰顯，且能夠吸引類似光寶集團這種本業與麗正相關的公司與之相互結盟，將可望產生雙贏局面。\n\n換句話說，麗正過去 20 年票面 10 元是天花板，如今麗正擦亮招牌後，被購併的戰略價值大幅提升，票面 10 元將成為堅實的厚地板，若其基本面能進一步從轉機蛻變成高成長，那麼股價在票面以下被壓抑 20 幾年的麗正，股價未來上檔空間相當寬廣。'],2019/01/21 15:55,Tesla、Apple加持麗正價值大爆發
48,https://news.cnyes.com/news/id/4265183,"['蘋果新手機銷售失利也砍首季財測，加上智慧型手機銷售疲弱，包括大立光 (3008-TW)、玉晶光 (3406-TW) 2018 年營收都出現衰退，玉晶光今 (8) 日公布指出，第 1 季營收仍屬淡季水準。', '玉晶光今日公布 2018 年 12 月營收為 6 億元，月減 16.69%，年減 39.99%，2018 年全年營收為 79.27 億元，年減 1.24%，去年第 4 季營收 21.4 億元，季減 9.96%，年減 20.97%。', '大立光日前公布的 12 月營收表現也不佳，去年全年營收達 499.52 億元，年減 5.98%。', '玉晶光原即對去年第 4 季營運看法保守，但是公司強調，光學元件中長期應用面擴散，有助營運表現，但第 1 季仍為營運的淡季。', '玉晶光董事長陳天慶則日前指出，智慧型手機搭載光學鏡頭 3D 感測、VR/AR 等新應用，搭載鏡頭數也在增加中，其中 3D 感測鏡頭由 1 顆增加為 3 顆，後置鏡頭也朝 3 鏡頭甚至 4 鏡頭發展，帶動包括大光圈、中距離及長焦鏡頭等需求。', '玉晶光公布 10 月自結單月稅後純益為 1.08 億元，月增 24.68%，年減 23%，加計前 3 季財報，玉晶光前 10 月稅後純益 7.54 億元，依目前 9.98 億元股本計算，每股純益為 7.56 元。']",2019/01/08 17:14,蘋果新機銷售不振光學廠大立光、玉晶光去年營收都見到衰退情形
49,https://news.cnyes.com/news/id/4275854,"['仁寶 (2324-TW) 今 (30) 日舉行旺年會，今年席開 712 桌，共有 7000 多人一同參與。董事長許勝雄指出，為鼓勵同仁生育，也推出「66 專案」，同仁每生育一胎，就可得\xa06.6 萬元的大紅包，8 年來仁寶共增加\xa02703 位新生兒，加上旗下金寶新生兒逾 1000 位，8 年以來共發出超過 2 億元的紅包。', '許勝雄今日也宣布，「66 專案」將延續一期 3 年，繼續讓同仁享有福利。', '關於同仁年終獎金，他強調，將「以 2 個月做平均值，再加考績獎金」，若算上中秋、端午獎金等，年終平均有 3 個月。', '仁寶今年藝人請來林明禎、畢書盡、黃子佼、動力火車輪番登場，壓軸則找來實力唱將徐佳瑩登場。']",2019/01/30 17:53,〈仁寶旺年會〉許勝雄：獎勵生育專案8年共發超過2億元的紅包
