,link,text,timestamp,title
44,https://news.cnyes.com/news/id/4270417,"['台股今 (18) 日受到美股與亞股走揚帶動，指數早盤開低後，在股王大立光與鴻海一路走高拉升下，盤中成功站回 9800 點，終場上漲 46.91 點，以 9836.06 點作收，成交量 958.27 億元，周線連 2 紅。三大法人今日同步買超，共買超 76.7 億元，自營商買超 19.61 億元，投信買超 6.93 億元，外資則是期現貨不同調，現貨買超 50.16 億元，期貨則減持多單 55 口，其中，外資大賣台積電逾 1.3 萬張。', '台指期部分，外資減持多單 55 口，多單未平倉口數減至 52332 口；投信回補空單 214 口，空單未平倉口降至 23350 口；自營商回補空單 1550 口，空單未平倉口數降至 2705 口。', '外資買超第 1 名為群創、買超 11154 張，第 2 名合庫金、買超 8920 張，第 3 名聯電、買超 8142 張，第 4 名華南金、買超 7865 張，第 5 名元大金、買超 6708 張，第 6 名華邦電、買超 6395 張，第 7 名第一金、買超 5675 張，第 8 名富邦上証正 2、買超 5606 張，第 9 名玉山金、買超 5404 張，第 10 名中鋼、買超 4772 張。', '外資賣超第 1 名新光金、賣超 19572 張，第 2 名富邦 VIX 、賣超 16800 張，第 3 名國泰金、賣超 13851 張，第 4 名台積電、賣超 13590 張，第 5 名中信金、賣超 5298 張，第 6 名中壽、賣超 4974 張，第 7 名環球晶、賣超 4074 張，第 8 名微星、賣超 3446 張，第 9 名旺玖、賣超 3182 張，第 10 名富邦金、賣超 2960 張。', '投信買超第 1 名國際中橡、買超 1518 張，第 2 名廣達、買超 1314 張，第 3 名台光電、買超 739 張，第 4 名矽創、買超 707 張，第 5 名聯茂、買超 692 張；投信賣超第 1 名元大台灣 50 反 1、賣超 8000 張，第 2 名長榮航、賣超 2601 張，第 3 名元太、賣超 1183 張，第 4 名遠東新、賣超 500 張，第 5 名台半、賣超 453 張。', '自營商買超第 1 名為元大滬深 300 正 2、買超 35096 張，第 2 名元大 S&P 原油正 2、買超 14092 張，第 3 名富邦上証正 2、買超 6271 張，第 4 名國泰中國 A50 正 2、買超 5234 張，第 5 名欣興、買超 2598 張；自營商賣超第 1 名元大台灣 50 反 1、賣超 24637 張，第 2 名富邦 VIX、賣超 13285 張，第 3 名國泰臺灣加權反 1、賣超 3211 張，第 4 名富邦 NASDAQ 反 1、賣超 2289 張，第 5 名旺宏、賣超 1271 張。', '國泰證期分析師蔡明翰指出，下周即將進入春節連假前最後兩周，雖然技術面強勢，但預期台股仍將呈現量縮格局，就過往經驗，農曆年後將有短線紅包行情可期，但以短線操作為原則，因台積電與大立光對今年上半年展望維持保守看待，指數中長期仍會回歸基本面表現。']",2019/01/18 18:03,三大法人買超76.7億元外資期現貨不同調大賣台積電逾1.3萬張
45,https://news.cnyes.com/news/id/4275460,"['蘋果 (AAPL-US) 為 2018 年底慘澹的結局預防針打得很好，週二蘋果公布財報接近華爾街的預期，無論是每股純益 EPS 或是營收皆略高於華爾街預期。', '儘管 iPhone 銷量下滑、停止發布 iPhone、iPad、Mac 等關鍵數字銷量，蘋果將市場關注轉向服務性營收、首度公開 iPhone 用戶基數等數據緩解市場擔憂奏效， 週二蘋果 (AAPL) 盤後股價飆高近 6%。', '外界普遍認為蘋果週二發布的最新財報是，自 2007 年發布 iPhone 以來最關鍵的一次，本次財報六大重點整理如下：', '重點一：蘋果首度公開 iPhone 用戶基數', '去年底蘋果宣布停止發布 iPhone、iPad、Mac 等銷量，稱單看 90 天銷售表現並不能正確反映蘋果的業績。隨著核心關鍵數據的缺失，但蘋果仍提供有關主要產品線的一些訊息。', '蘋果財務長梅斯特里 (Luca Maestri) 週二稱：「截至去年 12 月底，全球共有 14 億台活躍使用中的蘋果設備，其中\xa09 億台 iPhone 活躍設備佔比最高。」', 'Maestri 承諾：「從現在開始，此數據將定期更新。」', '蘋果首席執行官庫克說：「蘋果活躍使用設備在 2019 財年第一季達到了 14 億台的歷史新高，而且全球每個地區都在增長。這是我們客戶滿意度和忠誠度的一個很好的證明，受惠於我們龐大而快速發展的生態系統，將推動我們服務業務締造新的記錄。」', '重點二：服務部門毛利率高達 62.8%，Apple Music 是大功臣', '蘋果服務性營收表現超亮眼！蘋果表示，在 2019 財年的第一季，服務部門毛利率為 62.8%，這是扣除銷售成本後所得出的結果，高於去年同期 58.3%，遠高於整體業務的毛利率 (38%)。', '蘋果執行長庫克在電話會議中表示，整體服務業務實現了跨越式發展，創造 109 億美元的歷史新高，主要是歸功於 Apple Music，付費群高達 5000 萬個用戶。', 'Cross Research LLC 分析師 Shannon Cross 表示：「服務毛利率超過 60% 是積極的表現。」', '重點三：穿戴式、居家和配件類別 (先前稱為『其他產品』) 年增 33%', '市場人士表示：穿戴式、居家和配件成為蘋果季營收成長最快速的部門，是蘋果產品類別的強力戰將，搭配健康偵測應用的潛力不容輕忽。', '重點四：蘋果超強現金流', '蘋果財報中顯示，該公司現持有現金有 2450 億美元，高於上季的 2371 億美元，季增 3%。', '蘋果公司承諾在 2018 年開始的五年內向美國經濟帶來 3500 億美元的貢獻，部分原因在因應新的稅率。', '蘋果預計海外回流資金將需交稅 380 億美元，新增 2 萬個就業機會，並在德克薩斯州奧斯汀建立一個新園區。', '重點五：挽救 iPhone 銷量措施', '由於 iPhone 佔蘋果 12 個月營收約 63%，蘋果本月初下修財測引發了市場大恐慌。當時庫克警告：「由於 iPhone 銷售低於預期以及中國經濟疲軟，迫使蘋果下修今年第一季財測。」', '如今財報數據出爐，iPhone 銷售 519.8 億美元，年減 15%，大中華地區淨銷售為 131.7 億美元。', '庫克坦承：「我們的客戶比以前更長時間使用舊款 iPhone，將這與宏觀經濟因素 (特別是新興市場) 交互影響時，導致 iPhone 營收下滑 15%。」', '庫克透露蘋果正打算採取一系列行動來解決這一問題，包括以舊換新、分期付款等，以及計劃調整 iPhone 海外價格。', 'Wedbush 分析師 Daniel Ives 表示：「蘋果在中國面臨來自四面八方的低價競爭。蘋果需要確保在未來幾個季度，他們不會失去任何現有的 iPhone 用戶，因此在未來的日子裡，他們將面臨更大幅度的降價。」', '重點六：美中貿易戰影響趨緩', '除了價格因素影響蘋果大中華地區的銷售外，美中貿易戰引發「支持本土品牌華為，拒用蘋果」的消息也不容小覷。', '由於貿易緊張局勢影響 2018 年\xa0iPhone 銷售情況，展望未來，庫克稱看到美國和中國之間的緊張關係正在解凍。', '庫克稱：「我們已經進入一月份了。1 月份看起來比 12 月份好。我認為，貿易緊張局勢的影響顯然會更少。我對美中兩國能夠解決問題感到樂觀。」']",2019/01/30 09:30,〈蘋果財報略優〉iPhone 用戶基數首次揭露！一文掌握蘋果財報全重點
46,https://news.cnyes.com/news/id/4264438,"['在美國聯準會 (Fed) 主席鮑爾表示未來決定貨幣政策將更有「耐心」後，市場解讀升息速度將減緩，激勵美股大漲，亞股今 (7) 日也全面反彈，其中，台股加權指數開高走高，強彈超過 2.2%，終場收在 9590.3 點，上漲 207 點，量能則縮至 918 億元，演出破底翻的反攻行情，法人指出，農曆年前紅包行情主要是由內資主導中小型股走勢，平常心看待指數位置。', '大型權值股今聯袂大反攻，大立光強彈逼近 7%，可成、台達電均漲逾半根停板，台塑四寶有 2-5% 不等的漲幅，統一、統一超漲逾 3%，永豐金、開發金、華碩均漲超過 3%，聯電、亞泥、彰銀、台新金、元大金、華南金、鴻海、國巨、台積電和群創均漲逾 2%。', '而光寶科、遠傳、中租、正新、友達、中壽、遠東新、台泥、中信金和寶成等均漲超過 1.5%。', '在大立光的帶動下，光學鏡頭廠同步受到拉抬，新鉅科漲停，玉晶光漲半根停板，先進光、今國光、聯一光漲 4% 之上，亞光和佳凌漲幅在 3% 上下。', '而 5G 概念持續發酵下，相關中小型概念股持續受到追埲，光環一度漲停，華星光、眾達 - KY 漲 4% 上下，聯鈞漲近 3%。', 'IC 基板族群也再度轉強，景碩大漲 7%，同欣電和南電漲 4% 上下。被動元件族群也見到逢低買盤進場，除了國巨漲 2.4%，華新科大漲半根停板，蜜望實和禾伸堂漲 2-3% 左右。', '法人指出，蘋果下修財測導致美股重挫，蘋概股近來壓力重重，但實際上從去年第 4 季 iPhone 銷售不如預期以來，台股相關供應鏈股價皆已事先反映，儘管目前為產業淡季，股價不易有強勢表現機會，但短線不至於見持續重挫的壓力。', '事實上，大盤技術面仍處弱勢，所幸中小型股相對強勢，可判斷市場信心仍維持正向，短線投資人若有意布局紅包行情，可聚焦強勢中小型股中採偏多操作。']",2019/01/07 14:39,台股盤後 破底翻反彈行情發威強彈逾200點收復9500點
47,https://news.cnyes.com/news/id/4273151,"['2018 年，由阿根廷與土耳其引發的貨幣危機，挑戰投資人對新興市場信心，新興市場債券基金面臨資金流出，價格也一度下跌超過 10%。回顧過往新興市場債券表現，「鉅亨買基金」認為新興市場債券特色是回血快速，大跌後往往有好表現，偏好配息基金的投資人，可考慮逢低加碼新興市場債券基金。', '新興市場債大跌逾 10% 後表現亮眼', '從新興市場債券價格指數於 1991 年編纂以來，新興市場債券價格共經歷過 7 次顯著下跌期間（下跌幅度超過 10%），每次下跌後都是絕佳買點。當近 12 個月新興市場債券價格下跌超過 10% 時買入，後半年平均上漲 6.7%、上漲機率為 84%；後一年平均上漲 13.6%、上漲機率高達 94%（此處僅計算價格報酬率，若加計配息，報酬率將更高）。截至去年 12 月，新興市場債券近 12 個月價格下跌 9.9%，近雙位數的跌幅，提供投資人絕佳進場機會。', '先前提及新興市場債券價格共經歷 7 次顯著下跌期間，若加計配息，新興市場債券跌幅超過 10% 期間只剩三段，分別是 1994 年、1998 年與 2008 年。儘管新興市場債券於下跌期間經歷了 20% 至 35% 的巨大跌幅，但藉由高配息與價格迅速上漲的特色，分別只花了 9、18 與 8 個月就回到先前高點，反彈速度遠快於其他風險性資產（以標普 500 為例，為了回到 2002 年與 2007 年的高點，分別花了 49 個月與 58 個月）。', '新興市場債券回血速度快', '新興市場外匯存底遠高於過往', '除了跌出買點與反彈快速等優點外，新興市場債券另一支撐為基本面的改善。過去新興市場債券為人詬病的是新興市場國家政策不穩定、央行不獨立，違約機率較高。「鉅亨買基金」依照摩根新興市場債券指數權重（採權重前 12 名，總計佔新興市場債券指數的 50.4%），加權計算新興市場國家外匯存底，發現新興市場外匯存底金額由 1998 年的 130 億美元，大幅增加至如今的 1,882 億美元，新興市場外匯存底成長超過 14 倍，但同期新興市場債券金額只增加近 6 倍，新興市場償債能力遠優於過往。', '基金操作上，建議如下：', '股債要分開，新興市場債不能少', '我們認為 2019 年市場波動度將高於去年，建議投資人勿單押股票型基金，債券型基金也是資產配置重要一環。而債券型基金中的新興市場債券基金，經歷去年價格的大幅下跌後，目前適合投資人當做債券配置中的要角。', '>> 鋒裕匯理新興市場債券 A2(本基金主要係投資於非投資等級之高風險債券且基金之配息來源可能為本金)', '「鉅亨買基金」獨立經營管理\n本資料僅供參考，「鉅亨買基金」已盡力就可靠之資料來源提供正確之意見與消息，但無法保證該等資料之完整性。內容涉及新興市場部分，因其波動性與風險程度可能較高，且其政治與經濟情勢穩定度可能低於已開發國家，也可能使資產價值受不同程度之影響，匯率走勢亦可能影響所投資之海外資產價值變動。投資人應依其本身之判斷投資，若有損益或因使用本資料所生之直接或間接損失，應由投資人自行負責，本公司無須負擔任何責任。\n本文提及之經濟走勢預測不必然代表基金之績效，基金投資風險請詳閱基金公開說明書及投資人須知。\n基金經金管會核准或同意生效，惟不表示絕無風險，基金經理公司以往之經理績效不保證基金最低投資收益；基金經理公司除盡善良管理人之注意義務外，不負責基金之盈虧，亦不保證最低之收益，投資人申購前應詳閱基金公開說明書及投資人須知。\n各銷售機構備有基金公開說明書及投資人須知，歡迎索取。有關基金應負擔之費用（境外基金含分銷費用），已揭露於基金之公開說明書或投資人須知中，投資人可至公開資訊觀測站或境外基金資訊觀測站中查詢。\n投資人投資以高收益債券為訴求之基金不宜占其投資組合過高之比重。基金經金管會核准或同意生效，惟不表示絕無風險。由於高收益債券之信用評等未達投資等級或未經信用評等，且對利率變動的敏感度甚高，故基金可能會因利率上升、市場流動性下降，或債券發行機構違約不支付本金、利息或破產而蒙受虧損。投資人應審慎評估，該等基金不適合無法承擔相關風險之投資人。基金經理公司以往之經理績效不保證基金最低投資收益；基金經理公司除盡善良管理人之注意義務外，不負責基金之盈虧，亦不保證最低之收益，投資人申購前應詳閱基金公開說明書及投資人須知。\n投資於 Rule 144A 債券，境內高收益債券基金最高可投資基金總資產 30%; 境內以投資新興市場國家為主之債券型基金及平衡型基金最高可投資基金總資產 15%; 境外高收益債券基金可能有部分投資於美國 Rule 144A 債券，該債券屬私募性質，較可能發生流動性不足，財務訊息揭露不完整或因價格不透明導致波動性較大之風險。\n不動產證券化型基金得投資於高收益債券，其投資總金額不得超過基金淨資產價值之 30％。\n投資人因不同時間進場，將有不同之投資績效，過去之績效亦不代表未來績效之保證。\n基金配息率不代表基金報酬率，且過去配息率不代表未來配息率；基金淨值可能因市場因素而上下波動。\n基金配息前未先扣除應負擔之相關費用。基金的配息可能由基金的收益或本金中支付。任何涉及由本金支出的部份，可能導致原始投資金額減損。', '鉅亨網證券投資顧問股份有限公司 │ 客服信箱：cs@anuegroup.com.tw', '公司地址：台北市信義區松仁路 89 號 2 樓 A-2 室 │ 服務專線：(02)2720-8126 │ 服務時間：09:00-17:30']",2019/01/24 14:42,新興市場債今年有看頭
48,https://news.cnyes.com/news/id/4265259,"['金管會今 (8) 日表示，因應我國高齡化趨勢，消費者宜及早規劃以因應高齡化社會的老年長期照護需求，金管會提醒民眾可考量自身需求，適時購買長期照顧保險商品，為長期照顧風險預做準備，同時，應該注意兩大事項，以免產生爭議，尤其長照險與「特定傷病保險」及「殘扶險」商品不同，要特別注意。', '依「長期照顧保險單示範條款」，被保險人於符合契約條款約定的「長期照顧狀態」者，不論造成該狀態的原因是疾病或傷害，保險公司即應依約給付「長期照顧一次保險金」或「長期照顧分期保險金」，有助於民眾支應長期照顧所產生之一次性及持續服務需要。', '金管會提醒民眾購買長期照顧保險商品前宜注意下列事項，並應審慎評估自身的保障需求，及瞭解保險商品的特性，避免日後因認知不同而衍生爭議：', '一、「長期照顧狀態」定義：長照保險的「長期照顧狀態」是指被保險人符合契約條款約定的生理功能障礙，或認知功能障礙之一者，消費者於投保前應充分瞭解相關名詞定義。', '二、申領保險金應具備文件及免責期間：保險公司針對不同的長照給付項目，於契約條款明定受益人申領時應檢附的文件可能不同；另外，這類保險商品一般訂有「免責期間」，也就是指被保險人自符合「長期照顧狀態」起，需持續一段約定時間 (免責期間不得高於 6 個月) 後，保險公司才開始給付長期照顧保險金，消費者於申請理賠時應注意相關條款約定。', '金管會強調，目前市場上除了長期照顧保險商品外，亦有銷售含有定期給付的「特定傷病保險」及「殘扶險」商品，這些商品雖然與長期照顧保險商品一樣都具有定期給付保險金的功能，惟二者的理賠認定標準、承保事故及保障範圍各有不同，民眾購買前務必充分瞭解保險商品的特性及內容。', '金管會表示，有關保險契約當事人權利義務皆詳載於保單條款，各保險業所銷售長期照顧保單條款相關資料，消費者可逕自財團法人保險事業發展中心網站 - 保險專區 - 保險商品查詢選項中下載，或電洽保險公司 0800 免費服務專線、或向業務員索取。對於保單條款約定有不清楚的地方，除可逕向業務員諮詢外，亦可進一步向保險公司確認，以確保自身權益。']",2019/01/08 19:06,長照險與這兩種保險大不同金管會點名要注意
49,https://news.cnyes.com/news/id/4263830,"['由富邦金 (2881-TW) 旗下台北富邦銀行統籌主辦的利晉工程新台幣 30 億元聯貸案，超額認購完成募集並於今 (4) 日完成簽約。本案由台北富邦銀行、中國信託及元大銀行統籌主辦，東亞銀行共同主辦，其他參貸銀行包括華南銀行、彰化銀行、兆豐銀行、台新銀行及合作金庫。本聯貸案將用以支應利晉工程未來承攬各專案工程所需之履約保證金保證、預付款還款保證及工程週轉金等需求。', '北富銀總經理程耀輝表示，既往營造業資金運作模式是先標下工程，再根據該標案尋找合作銀行核予專案授信額度並專款專用，在每項標案都要進行相同程序的情況下，時間壓力和重複繁瑣流程成為營造業者本業以外的一大負荷。因此 2015 年北富銀與利晉工程首度攜手合作，啟動營造業聯貸創新模式，提前針對利晉工程未來二至三年可能的工程標案與量體進行精準評估分析，建立完整的融資架構規劃，並於當年度順利完成新臺幣 24 億元聯貸籌組。', '三年以來，該聯貸額度成功支應利晉工程許多重要工程標案，包括萬華車站 BOT 案、和碩科技立德三館、好市多量販店新莊店、富邦媒體科技 momo 物流大樓、新日興樹林廠等工程建設之完成◦', '由於該創新模式運作順利且量體評估精準，前次聯貸額度經三年恰好用滿，北富銀本次再度與利晉工程合作發起新聯貸案，原定募集新臺幣 25 億元，因銀行參貸熱烈，超額認購金額達 1.3 倍，最終本案以新臺幣 30 億元完成簽約，成為利晉未來三年爭取更多優質工程標案的最佳後盾，也為金融業與營造業的合作寫下新的里程碑。\n\xa0\n利晉工程成立迄今超過半世紀，工程業務範圍遍及飯店業、倉儲業、電子業、紡織業、醫療業等各大行業，是全台科技業興建廠辦之首選廠商，承攬興建宜蘭縣立蘭陽博物館、台北市立動物園熊貓館、台北信義商圈華南金控總部大樓及 BELLAVITA 精品百貨等知名建案，其中蘭陽博物館不僅成為當地地標，更獲得行政院公共工程金質獎建築類特優獎殊榮，工程品質優良深獲各界肯定。', '本次聯貸案獲得多家銀行認同順利完成，對金融業與營造業的創新合作具指標性意義。北富銀表示，未來該行也將繼續協助營造業資本動能有更佳發揮，齊力推動產業競爭優勢，為國內經濟與建設發展貢獻心力。\n\xa0']",2019/01/04 18:19,北富銀主辦利晉工程30億元聯貸案超額認購完成募集
50,https://news.cnyes.com/news/id/4273425,"['「OPEN BANKING」(開放銀行) 風潮吹進台灣金融業，台灣也有部分銀行藉由異業結盟串接切入 OPEN API 領域，但銀行認為，台灣想要成功發展 OPEN BANKING，勢將面臨三大挑戰，包括：制定標準化 API、掌握客戶意願，並保護客戶權益。', '過去民眾想在某家銀行開戶時，必須先填寫相關資料，但如果要到另一家銀行開戶同樣的資料還是要再寫一次，不過歐美近年來正積極推廣的 OPEN BANKING(開放銀行)，只要徵得消費者同意後，就能將其資料透過應用介面程式 (API) 與其他銀行或第三方業者合作，量身打造金融服務，堪稱是金融科技的一大突破。', '華南銀行表示，API 本身技術不難，幾乎各家銀行都有類似技術服務，但想要順利串接與開發資料，關鍵在制定標準化 API，唯有透過標準化才能降低串接難度。', '而過去 API 串接主要用於交易，但現在的 OPEN BANKING 則是讓客戶擁有資料主導權，讓客戶決定要把資料提供給誰，但資料涉及個人隱私保護，換言之，未來銀行發展 OPEN API 必須克服兩大關卡，包括確認客戶意願與如何保護客戶資料，降低不必要的糾紛。', '目前包括台新、凱基等民營銀行都有 OPEN API 相關服務，以台新銀行為例，將旗下網銀與日本電商串接，台新網銀客戶可利用網銀帳號直接登入電商平台購物，還能利用信用卡紅利點數享受消費折扣。', '凱基銀行 2017 年上線的「KGI inside」開放 API，與金融科技業者 (Fintech) 串接，讓非凱基銀行的客戶也透過線上申辦信用卡與信貸業務。', '華銀也有類似的服務，開放網路收單、付款、餘額查詢與身分確認等 OPEN API，與金融科技、零售通路、醫療、電信與醫療業者串接，讓金融服務可透過異業結盟與客戶接觸。', '而為了發展 OPEN BANKING，華銀數位金融團隊還為此成立相關研究小組，透過參與銀行公會研擬制定標準化 API，並與金管會及金融總會推動的 Fintech Space 金融科技創新園區及政大金融科技中心合作，打造新的商業模式。', '\n\xa0']",2019/01/24 20:54,開放銀行風潮吹進台灣銀行想成功必須先克服這三大挑戰
