,link,text,timestamp,title
25,https://news.cnyes.com/news/id/4267400,"['2018 年，台股在走了 9 個月的多頭行情之後，突迎來 10 月份的大崩跌，結束史上最長萬點行情，進入大震盪，最終全年下跌 8.6%，投資人哀號賺了一年的錢全賠回去。根據投信投顧公會資料，2018 年全年 167 檔投資國內的股票型基金及 ETF 中，僅 12 檔為正報酬，其中報酬率前十大僅 3 檔為基金，其餘 7 檔是 ETF，年度冠軍是國泰臺灣低波動 30 ETF(00701-TW) 全年報酬 5.2%，表現相對優異亮眼，顯示低波動不等於低收益。', '報酬率前十大基金及 ETF，除了野村台灣高股息年報酬 4.22%、安聯台灣大壩 3.28%、匯豐成功 1.2% 為基金以外，其餘包括：國泰臺灣低波動 30 ETF 年報酬 5.2%、元大台灣 ETF 傘型之金融基金 (0055-TW)4.55%、富邦台灣金融 ETF(0059-TW) 4.03%、群益臺灣加權單日反向 1 倍 ETF(00686R-TW) 0.91%、國泰臺灣加權指數單日反向 1 倍 ETF(00664R-TW) 0.87%、元大台灣 50 單日反向 1 倍 ETF(00632R-TW) 0.83%、元大台灣高股息 ETF(0056-TW) 0.71% 都是 ETF。', '近三年多以來，ETF 投資愈來愈夯，除了投資基金以外，愈來愈多投資人認識 ETF 並開始參與 ETF 的投資，過去民眾可能認為 ETF 是經常出入股市，短線交易的標的，但其實 ETF 也可以做為長期投資工具，如臺灣低波動 ETF 類型，目前在台股掛牌交易的低波動 ETF 有 2 檔，分別為：國泰臺灣低波動 30、元大臺灣高息低波 (00713-TW)。', '因為低波動概念股相當於「存股懶人包」，一次將好股票全包在一支 ETF，就能享有抗震且低波動的優點，不論何時進場都是好時點，單筆或定期定額投資都很合適，是投資人在做退休理財、長期存股時，常做的選擇，也是國際股市動盪下最佳長期投資標的。', '而國泰臺灣低波動 30 ETF 奪下去年的績效冠軍，證明了低波動不等於低收益，反而因為其追蹤的是台股市場中的低波動股票，這些股票必須是業績優良的類股，才能維持穩健股價。', '分析國泰臺灣低波動 30 ETF 成分股中如：中華電、南亞、國泰金、中信金、富邦金、中鋼等，皆是市場上殖利率高且股價穩健的好股票，在市場越震盪時，反而更能夠抗跌，跌幅明顯低於大盤，而市場回升時，則發揮領漲的特色。', '\xa0']",2019/01/13 10:30,2018年績效冠軍是低波動ETF 低波動不等於低收益
26,https://news.cnyes.com/news/id/4273912,"['台股今 (25) 日在台積電揮軍之下，終場大漲 92.49 點，收在 9969.61 點，單周上漲 133 點，周線連三紅。而台股在 12 月 5 日跳空跌破萬點之後，今天反彈創波段新高，助攻指數強彈的推手就是三大法人，三大法人合計買超 192.05 億元，其中，外資買超 158 億元，加碼金額不但是今年最高，更創 2017 年 6 月 26 日、一年半以來新高，顯示大搶紅包準備過年。', '外資買超 158.3 億元，投信買超 6.01 億元，自營商買超 27.71 億元，三大法人合計買超 192.05 億元。', '外資在 2017 年 6 月 26 日買超 171 億元之後，雖然台股直到去年第四季才因為股災跌破萬點，但這一年半以來，外資買超的金額就再也未見如此大手筆；外資今天一口氣大買 158.3 億元後，外資不但連買 7 天，統計今年以來，外資更已買超 318.66 億元，逐步揮別去年 12 月單月大砍 668.6 億元的慘烈。', '而在台指期淨部位方面，三大法人淨多單增加 5892 口至 32632 口，其中外資多單加碼且空單減碼，淨多單增加 9416 口至 61112 口；十大交易人中的特定法人全月份台指期淨多單增加 7603 口至 31410 口。', '再看外資個股操作，外資買超前 10 名個股：緯創 25107 張、友達 20845 張、中信金 19516 張、華邦電 19270 張、聯電 16981 張、台積電 15831 張、群創 13917 張、元大滬深 300 正 2 獲買超 13788 張、中鋼 13535 張、華南金 10225 張。可以發現電子權值股如晶圓雙雄、面板雙虎，以及金控權值股都是外資抱股過年的標的。', '外資賣超前 10 名個股：富邦 VIX 遭賣超 12708 張、元大台灣 50 反 1 遭賣 8423 張、富邦金 7648 張、國泰金 7544 張、中環 6990 張、新光金 6135 張、長榮航 5179 張、京元電子 4928 張、大成鋼 4638 張、奇美材 3940 張。', '外資雖然近期持續押寶金控股，但卻依舊對壽險金控砍殺不手軟，富邦金遭連賣 12 天、累計賣超 7.9 萬張，國泰金更是連續賣超 18 天、累計賣超 13.5 萬張，新光金也被連賣 11 天、但累計賣超卻高達 16.5 萬張。', '投信買超前 10 名個股：京元電子 2855 張、長榮航 1708 張、緯創 1706 張、欣興 1391 張、上詮 1349 張、上緯投控 1030 張、同欣電 1026 張、順德 843 張、頎邦 783 張、神基 736 張。', '投信賣超前 10 名個股：大成鋼 2417 張、開發金 1877 張、上海商銀 1776 張、啟碁 1613 張、台肥 1206 張、台表科 890 張、中鋼 800 張、中華電 697 張、宣德 454 張。', '自營商買超前 10 名個股：元大滬深 300 正 2 獲買超 84412 張、元大 S&P 原油正 2 獲買超 13020 張、富邦上証正 2 獲買超 12783 張、元大高股息 10085 張、國泰中國 A50 正 2 獲買超 8914 張、元大台灣 50 獲買超 4277 張、台新 MSCI 中國正 2 獲買超 3420 張、元大全球 AI 獲買超 2936 張、元大台灣 50 正 2 獲買超 2158 張、國泰中國 A50 獲買超 1995 張。', '自營商賣超前 10 名個股：元大台灣 50 反 1 遭賣 54689 張、富邦 VIX 遭賣 10052 張、富邦臺灣加權反 1 遭賣 2389 張、國泰臺灣加權反 1 遭賣 1723 張、大成鋼 1490 張、元大 S&P 原油反 1 遭賣 1384 張、旺宏 1296 張、彩晶 688 張、南亞科 555 張、台表科 519 張。', '整體來說，外資在期現貨持續同步作多，且台股今日呈現量價齊揚，後續上檔或有萬點賣壓出籠，惟從技術面來看，日 K 連二紅增量並沿五日線續創反彈新高，日 KD 指標高檔出現鈍化，且出量攻擊態勢明確，只要國際股市氣氛仍好，外資持續捧場，封關前再戰萬點可期。']",2019/01/25 17:59,外資狂買158億抱股過年買超手筆創一年半新高三大法人合買192億元
27,https://news.cnyes.com/news/id/4268433,"['隨著美中貿易戰獲得階段性緩和，且近來美國聯準會 (Fed) 態度轉趨鴿派，永豐金證券今 (15) 日指出，元月效應正在各國股市發威，美股和去年大跌的新興市場皆值得注意，特別是美國標普 500 指數、NASDAQ 100 指數、健康醫療、必須消費和非必須消費等 ETF，都是這波值得留意的投資方向。', '永豐金證券表示，衝擊 2018 全球金融市場的兩大變數都在今年開年就獲得喘息空間，全球股市元月效應發酵，包括美股和去年大跌的新興市場，到農曆年前都是可以注意的市場。', '尤其本周起美國迎來超級財報周，考慮到 APPLE 已調降財測，市場預期部份公司可能跟進調降財測或財報低於預期，正是檢驗投資布局的好機會。', '美國聯準會主席鮑爾 10 日公開演說，強調對貨幣政策保持耐心，預期美國 2019 年經濟與通膨溫和增長，並未看到衰退跡象；同時，美國年終消費仍熱絡，最新的就業數字優於市場預期，顯示目前景氣尚無步入衰退，也印證 12 月底以來美股的彈升並非無基之彈。', '永豐金證券也說明，去年第 4 季除了巴西以外主要股市全面重挫，MSCI 全球股票指數下跌達 13.74%，那斯達克綜合指數跌幅更高達 17.54%，隨著兩大變數壓力減緩，新興市場股債經過時間整理，有機會隨著美股走揚而有表現。']",2019/01/15 15:05,元月效應持續發酵永豐金證券點名投資方向
28,https://news.cnyes.com/news/id/4267877,"['為因應創新金融科技發展，財金公司於 2016 年起就與國內主要大型銀行共同成立「金融區塊鏈研究暨應用發展委員會」，在歷經 2 年多區塊鏈技術探索與實作驗證，即日起推出全球首創的「金融區塊鏈函證」服務，國內區塊鏈應用發展邁向新里程。', '財金公司表示，截至 1 月 15 日止，計有國內 27 家主要銀行、超過 100 多家會計師事務所，以及證交所、台灣集中保管結算所等 500 多家企業共同參與；金融企業中，以元大金控旗下所有子公司逾 200 家率先加入，對於推動 e 化作業最為積極。目前參與的會計師事務所，針對企業 2018 年度財報查核，已採用此項結合金融科技的電子化函證作業服務，以達成系統無紙化應用與降低作業風險，有效提升金融機構與會計師事務所的審計作業效能。', '財金公司說明，函證是會計師查核企業財務報表時，向金融機構發送詢證函以獲取並評估查核證據的程序。以往需要由查核人員先將紙本詢證函遞交企業用印後，再寄送企業往來金融機構的總行或分行，由於金融機構多以人工方式填覆後再回寄給查核人員，過程不僅耗時費力，內容亦有人工填具疏漏錯誤的可能，且若未以掛號交寄，恐衍生企業印鑑及財務資料外洩、詢證函遺失及遭竄改、變造等作業風險。', '為解決上述函證問題，財金公司協同金融機構、會計研究發展基金會，運用區塊鏈特性，導入「金融區塊鏈函證」創新應用，將傳統的紙本函證內容數位化，使資料得以更加安全、機密、快速地傳遞。', '財金公司表示，目前在去 (2018) 年 7~11 月的試營運發現，結合區塊鏈與 API 技術雙效出擊，函證查詢時間可由平均半個月縮短到一天。除了節省作業時間及成本外，以往受查企業動輒須用印數十件、甚至數百件的企業授權書，只要以工商憑證、證期共用憑證等電子簽章進行一次線上授權即可輕鬆完成，大幅提升人員工作效能。', '在資訊安全部分，財金公司指出，「金融區塊鏈函證」服務透過點對點傳輸，詢證函的收送，皆由金融機構及會計師事務所的憑證加密簽章，未被授權的第三方無法讀取內容，查核人員並可使用專屬 QR Code APP 掃碼，驗證詢證函內容是否有被竄改，使函證作業更為安全可靠。', '此外，「金融區塊鏈函證」服務除提供會計師事務所及銀行 WEB 網頁操作介面外，另支援 API 介接，以達到系統全自動的效益；未來詢證函更將支援 inline 的 XBRL 格式，使查核單位的運用更加多元及彈性，顯著提升審計作業的效能。']",2019/01/14 16:04,全球首創紙本函證數位化財金公司推金融區塊鏈函證服務
29,https://news.cnyes.com/news/id/4266852,"['世界銀行表示，預計 2018 年巴西經濟增長 1.2%。對於 2019 年，該機構認為，假設巴西的財政改革很快付諸實施，消費和投資的復甦將抵消政府支出削減的影響，預計巴西經濟將增長 2.2%。', '新聞來源: 新浪新聞 2019-1-9', '2018 年美元計價巴西股市下跌 1.79%，在全球 91 個主要國家股市指數中，排名第 15，表現亮眼。今年以來，更是受到新總統上台的提振，以 9.21% 的漲幅居冠，而同樣屬於拉丁美洲的阿根廷與哥倫比亞股市，也分別居第 2 與 6 名。此時投資人不免擔心巴西股市會否複製去年走勢，一月大漲後便迎來接連下跌。「鉅亨買基金」認為相較去年，巴西股市有著美元轉弱與經濟數據好轉兩大優點，但投資人仍應考量自身風險屬性，巴西股票佔整體資產配置比重不應過高。', '巴西經濟領先指標率先上升', '從去年以來，全球大部份國家經濟數據都在轉差（花旗全球主要國家驚奇指數由去年 1 月高點的 52.6 降至目前的 - 31.1，花旗新興市場驚奇指數則從去年 3 月高點的 39.5 降至目前的 - 15），但巴西卻是少數好轉的異類（製造業採購經理人指數從去年 6 月的 49.8 升高至 52.6）。去年年中罷工結束後，巴西工業信心便不斷升高，而消費者信心則是在選舉後一飛衝天，兩者的強勁表現都是巴西基本面改善的最好證據。', '經濟成長率與股市表現密切相關', '經歷 2015 與 2016 年連續 8 個季度衰退後，巴西經濟成長率於 2017 年回到正增長，但 2017 年與 2018 年連續 2 年經濟成長率都低於 1.5%，強勁的經濟成長還未出現，巴西仍處於景氣復甦的早期。從上圖可看出，從 1997 年以來，巴西股市表現與經濟成長率走勢一致，當經濟成長率升高時，股市通常都表現優異。根據世界銀行與各家投資機構預估，今年巴西經濟成長率可望進一步升高至 2.2%-2.5%，有利股市表現。', '除了本身經濟數據強弱外，美元與原物料價格同樣是影響巴西股市表現的關鍵（巴西為重要原物料出口國）。根據「鉅亨買基金」研究，藉由美元期貨投機淨部位變化，可判斷美元指數的走勢。如下圖，當美元期貨投機淨部位觸頂後，美元指數往往跟隨來到期間高點。美元期貨投機淨部位於去年 11 月創下 40,513 口的高點後，已經緩慢下降至目前的 36,049 口，加上聯準會轉趨鴿派，美元指數轉弱機率較高。若美元指數回弱，除了直接有利巴西里爾兌美元匯率外，也會透過提振原物料價格方式，推升巴西股市（能源與原物料類股佔巴西股市權重近 33%）。', '一致看多美元，美元指數轉弱機率高', '基金操作上，建議如下：', '分批買巴西，再加新興市場', '在美國經濟數據轉差，但又不到經濟衰退的情形下，對於希望追求較高收益且願意承擔風險的積極型投資人，可持續分批佈局巴西基金，但佔整體資產配置比重不宜超過 10%，而穩健型投資人，則建議以整體新興市場股票型基金為配置重點。', '>> 法巴百利達巴西股票基金 C (美元)', '>> 貝萊德新興市場股票收益基金 A2 美元', '\xa0', '「鉅亨買基金」獨立經營管理\n本資料僅供參考，「鉅亨買基金」已盡力就可靠之資料來源提供正確之意見與消息，但無法保證該等資料之完整性。內容涉及新興市場部分，因其波動性與風險程度可能較高，且其政治與經濟情勢穩定度可能低於已開發國家，也可能使資產價值受不同程度之影響，匯率走勢亦可能影響所投資之海外資產價值變動。投資人應依其本身之判斷投資，若有損益或因使用本資料所生之直接或間接損失，應由投資人自行負責，本公司無須負擔任何責任。\n本文提及之經濟走勢預測不必然代表基金之績效，基金投資風險請詳閱基金公開說明書及投資人須知。\n基金經金管會核准或同意生效，惟不表示絕無風險，基金經理公司以往之經理績效不保證基金最低投資收益；基金經理公司除盡善良管理人之注意義務外，不負責基金之盈虧，亦不保證最低之收益，投資人申購前應詳閱基金公開說明書及投資人須知。\n各銷售機構備有基金公開說明書及投資人須知，歡迎索取。有關基金應負擔之費用（境外基金含分銷費用），已揭露於基金之公開說明書或投資人須知中，投資人可至公開資訊觀測站或境外基金資訊觀測站中查詢。\n投資人投資以高收益債券為訴求之基金不宜占其投資組合過高之比重。基金經金管會核准或同意生效，惟不表示絕無風險。由於高收益債券之信用評等未達投資等級或未經信用評等，且對利率變動的敏感度甚高，故基金可能會因利率上升、市場流動性下降，或債券發行機構違約不支付本金、利息或破產而蒙受虧損。投資人應審慎評估，該等基金不適合無法承擔相關風險之投資人。基金經理公司以往之經理績效不保證基金最低投資收益；基金經理公司除盡善良管理人之注意義務外，不負責基金之盈虧，亦不保證最低之收益，投資人申購前應詳閱基金公開說明書及投資人須知。\n投資於 Rule 144A 債券，境內高收益債券基金最高可投資基金總資產 30%; 境內以投資新興市場國家為主之債券型基金及平衡型基金最高可投資基金總資產 15%; 境外高收益債券基金可能有部分投資於美國 Rule 144A 債券，該債券屬私募性質，較可能發生流動性不足，財務訊息揭露不完整或因價格不透明導致波動性較大之風險。\n不動產證券化型基金得投資於高收益債券，其投資總金額不得超過基金淨資產價值之 30％。\n投資人因不同時間進場，將有不同之投資績效，過去之績效亦不代表未來績效之保證。\n基金配息率不代表基金報酬率，且過去配息率不代表未來配息率；基金淨值可能因市場因素而上下波動。\n基金配息前未先扣除應負擔之相關費用。基金的配息可能由基金的收益或本金中支付。任何涉及由本金支出的部份，可能導致原始投資金額減損。', '鉅亨網證券投資顧問股份有限公司 │ 客服信箱：cs@anuegroup.com.tw', '公司地址：台北市信義區松仁路 89 號 2 樓 A-2 室 │ 服務專線：(02)2720-8126 │ 服務時間：09:00-17:30']",2019/01/11 10:28,巴西基金猛漲的三個關鍵
30,https://news.cnyes.com/news/id/4269655,"['中華電信 (2412) 今(17)日表示，繼 2018 年底獲國際報告權威機構 OpenSignal 公布調查報告「4G 下載速度」及「整體下載速度」獲業界雙料冠軍，蟬聯第一。國際權威測速領導品牌 Ookla 旗下知名網站 Speedtestâ 於 16 日公布台灣行動網速最新調查結果，中華電信蟬聯 2018 年下半年「台灣行動網速第一名」大獎。依據 Speedtestâ 網站所公布，2018 年下半年台灣電信業者行動網路報告，是採集全台 74 萬台裝置、超過 696 萬次測量樣本，所分析出來的報告結果，其測試結果亦獲國內外媒體大量引用。分析報告顯示，中華電信行動平均下載速度遠超越同業達 26%-219%，而且速度得分較上半年成長 14%，下載速度更相較上半年成長 14% 達 53.89Mbps，成長幅度皆為業界之冠。而手遊族群最在意的「低延遲度」達 25ms，也為業界之冠。\n\n依據通傳會公布最新全台 4G 基地台數量，中華電信在 2018 年 12 月底達 14,599 台，為業界最多，且在全台各縣市佈建數量均為第一，相較同年 7 月底成長 12%。由於基地台數量持續大幅超越同業，4G 網路品質也大幅躍進。\n\n中華電信董事長鄭優表示，蟬聯 Speedtestâ、OpenSignal 下載網速冠軍的殊榮，是客戶對中華電信最大的肯定。中華電信行動通信分公司總經理陳明仕表示，2019 年，為更能提升尖峰時刻客戶下載速率，4G 將持續建設高頻段基地台 (1800MHz 及 2600MHz)，同時特別針對全台超過 500 處人潮密集區域，運用中華電信擁有全台 4G 最大頻寬資源，獨家提供高速基地台 6CC 技術，讓客戶對行動品質提升更有感。']",2019/01/17 14:11,中華電去年底4G基地台為業界最多蟬聯Speedtesta台灣行動網速冠軍
31,https://news.cnyes.com/news/id/4272420,"['基金是許多人有興趣的投資理財工具之一，目前台灣共上架逾 1800 檔基金，怎麼「選」也是投資人常問的問題，市場正紅且報酬率超高的基金，就是值得追逐的標的嗎？學會 3 個步驟，你就可以聰明挑出同類型基金中的「模範生」。', '根據投信投顧公會統計，截至 2018 年 12 月底，台灣上架的境內基金有 859 檔、境外基金有 1035 檔，合計 1894 檔。一般投資人沒有時間深究這些基金商品，也沒有親友可以「報明牌」，那該怎麼辦？最簡單的又科學的方式，就是利用為台大教授邱顯比、李存修教授所設計的「四四三三法則」來挑選。', '所謂的「四四三三法則」是以時間來檢視基金過去的中長期績效。第一個「四」是選取近 1 年同類基金績效排名在前 1/4 的基金；第二個「四」是從選出來的名單中，選取最近 2、3、5 年及今年來績效也在前 1/4 的基金；最後兩個「三」則選出最近 6 個月績效為前 1/3，以及最近 3 個月，績效也為 1/3 的基金。', '透過「四四三三法則」層層篩選出來的基金，就像每次考試都能擠進前 3 名的學生，即使不是當紅的「明星基金」，至少也是同類基金當中的「模範生」。那麼該如何道自己有意申購，或目前持有的基金商品是否符合「四四三三法則」？進入鉅亨網基金頻道，用 3 個步驟就可以輕鬆找到答案！', '投資人點入單檔基金頁面後，可以在「基金概況」看到該檔基金的同組排名：\n1) 1 年績效應該贏過同組至少 75%(前四分之一)\n2) 再看今年以來、3 年、5 年績效是否至少 75%\n3) 接著看 3 月和 6 月績效是否有超過 67%(前三分之一)\n\xa0', '\n提醒投資人，使用四四三三法則時要特別注意，必須「同類型」基金進行比較，不能把能源基金跟股票基金、債券基金等相提並論，且觀察的若是外幣避險級別基金，建議以熱門貨幣的主級別基金取得組別排名的參考，以 「熱門貨幣的主級別基金」為篩選範圍。另外此法則主要是篩選中長期績效的基金，波動度大、投資風險度高的基金，可能 3、5 年績效名列前茅、拉長看到 10 年報酬率也驚人，但 3 月及 6 月的績效卻殿後，無法被篩選出來，成為遺珠之憾。', '除了績效之外，千萬不可忽略基金的波動風險，應配合本身的投資屬性，適當調整布局策略。根據 Anue 鉅亨網「投資老司機」App 分析，持有符合四四三三法則基金的老司機，如: 魔力紅、JJHJ、亮爸、jnlin 等，近一年績效不僅為正，也優於大盤。此外，進一步分析會發現，這些投資好手不僅只選擇中長期績效佳的基金，也搭配風險分散等布局規劃，來創造勝率。\n\xa0', '\n鉅亨網「投資老司機」App 裡，網羅了 1000 多位投資好手，最大的特色就是，用戶能看見每一位老司機的真實交易資訊與資產配置，投資人可藉由這種透明的專業資訊，選擇投資標的，跟著贏家的腳步前進，就能提高獲利機會。', '立即下載「投資老司機」→https://bit.ly/2QhkGlK']",2019/01/23 11:43,股票基金選擇好多怎麼辦？簡單3步驟就能挑出「模範生」
32,https://news.cnyes.com/news/id/4275058,['金管會將於 2 月中旬農曆年後，公布兩張純網銀執照花落誰家，開發金 (2883) 旗下凱基銀行宣布斥資 7 億元投資國家隊 - 將來銀行，持股比重約 7%，係為兆豐銀、新光金 (2888) 第三家加入將來銀行的金融業者，也是金融監理沙盒，與中華電信 (2412) 另一項合作案。此次兩家純網路銀行開放設立，係為 1990 年 10 月開放新設銀行之後，政府再度開放銀行執照申請，目前表態競逐的團隊 LINE BANK、樂天，以及中華電信籌組的國家隊等三組人馬，形成「三搶二」的局面。\n\n純網銀設立最低資本額為百億元，將來銀行係中華電信領軍，持股比重最高約 3 成，零售業主要成員為全聯，金融業參股的股東明朗化，包括兆豐銀、新光金，以及凱基銀，新光金投資金額約 10 億元，凱基銀約 7 億元，股權比重各為 10%、7%。\n\n凱基銀在發展 Fintech 策略可以區分為對內、對外兩塊，其對外發展目標係為打造「API 客製化金融服務任意門」為目標，網銀以生活繳費、數位金流、行動身份認證為主，行動銀行強調 AI + 大數據、數位貸款、P2P 金流保管、信用評分等。'],2019/01/29 14:19,開發金旗下凱基銀入股將來銀行7%股權比重為第三家入股金融業者
